[作品信息]作品名称,院系,[类别信息]高校,(哲学社科类)[作品信息]简介
鄱阳湖区沙化土地治理中农民行为调查研究,管理,江西师范大学,在鄱阳湖区土地沙化背景下，本研究从沙化土地治理中的农民行为入手，深入调查农民在沙地治理中的行为，分析影响农民行为的主要利益驱动，提出“生态治理与农民利益双赢、政策有效引导农民行为”的沙化土地治理对策，为提高沙地综合治理与利用的效益，促进湖区经济—社会—生态的协调发展，推进鄱阳湖生态经济区建设提供参考。
山东省新入职基层大学生公务员现状研究,管理,山东大学威海分校, 本文旨在对山东省新入职基层大学生公务员进行研究。选取全国人口大省山东省为典型代表，以各项社会管理任务繁重，对推动山东各地经济、社会发展发挥着重要作用的基层公务员为典型代表，选取以山东省东、中、西部五个县市区的新入职基层大学生公务员以及山东大学（威海）的学生为调查对象。以期帮助政府全面了解基层社会工作者现状，正确决策提供依据，并为在校大学生择业提供坚实可靠的理论支撑和指导。
市民化转型中的群体性焦虑：进城务工女性的心理问题与治理对策 ,管理,华中师范大学, 作品聚焦进城务工女性的心理健康，通过企业重点调研和全国22省市普遍调研，分析了进城务工女性的心理健康水平和主要心理问题，在市民化转型中剖析进城务工女性产生心理问题的制度性根源，通过H厂干预实验总结出缓解进城务工女性心理危机的行动模式。最后，展望了在城镇化和市民化进程中，政府、企业和社会组织多元联动，共同治理进城务工女性心理健康的多中心合作路径。
我国科学研究中的公共财政效率：低效与浪费,管理,兰州大学,由公共财政支持的科研项目必须承担公共受托责任，保证财政效率。本研究依照科学程序选取了各29项以“政府”为研究对象的国家社科基金与自然科学基金项目，通过对结项成果的“论文数量”、“论文丰满度”、“他引频次”、“复合影响因子”和“下载频次”等5个指标财政效率的测算，发现科研项目是消耗公共资金的“巨兽”等问题，进而提出改变政府既当“赞助商”、又当“裁判员”的现状，并成立科研项目评价事务所等措施。
湘西北地区小城镇防震减灾调查与研究报告,管理,湖南文理学院,近2年来，课题组成员通过查阅相关文件与资料，学习相关专业理论，掌握国内外防震减灾的研究动态，并赴湘西北地区常德市临澧县、石门县、桃源县、张家界市桑植县等十余个小城镇开展防震减灾建设现状的调研。从法律、技术、网络、空间、服务等八个方面提出了小城镇防震减灾规划对策与建议。围绕主题，课题组在国内优秀刊物上公开发表论文10篇，并且将理论研究成果运用于相关工程实践中，得到了社会各界一致好评。
烟台地区不同编制护士离职相关因素的研究,管理,滨州医学院, 离职意愿是个体在一定时期内变换工作的可能性，是离职的前因变量。当前全球护士流失逐年上升，这将不利于护理学科的可持续发展。鉴此，研究者于2012年3～5月采用护士离职意愿量表、工作压力源量表及自测健康评定量表对155名在职护士进行了问卷调查，发现其离职意愿较高，与工作压力呈正相关、与心理健康呈负相关。建议管理者从统筹管理人力资源、提升护士社会地位、注重护士心理支持等方面进行有效干预。
长春市立体停车场建设研究,管理,长春大学," 根据长春市停车空间浪费、利用率低问题, 参照发达国家的做法, 兴建自动化立体停车系统应是缓解长春交通拥堵、泊车难的一项十分有效的办法。 通过文献查询、现场调研勘测、调査问卷和分析归纳等研究方法，对长春市停车空间展开全面的调研和分析，归纳长春市停车空间面临的主要问题，在此基础上，提出了解决长春市停车难问题的对策，即兴建自动化立体停车系统。"
"""国培计划""参与性课程资源库的构建",教育,河北师范大学,本课题的研究特色为“5新”。新概念：提出“参与性课程”和“参与性课程资源库”的概念；新理念：提出互动性、民主性、趣味性、自主性、情境性、生成性和实用性七个新理念；新流程：确定了活动资源开发流程和实物、信息化资源的开发途径；新类型：对活动、实物、信息化资源进行细致地分类；本课题开发出5本活动资源活页资料、5本实物资源行动手册和5张信息化资源光盘，内容涵盖初中七八和高中一二三五个年级。
大学生道德判断力测量及其影响因素的探究,教育,上海海洋大学,本项目从社会道德缺失现象出发，以科尔伯格道德发展阶段理论为根据，以大学生为研究主体，结合其在家庭、学校等方面的个人经历，通过访谈和问卷的形式测试大学生的道德判断力，并探究其主要影响因素及影响过程，并有针对性地提出具体的、可操作的建议，为构建自律式的道德社会提供一定的参考价值。
大学生生命价值观在核心自我评价与挫折承受力间的中介效应,教育,齐齐哈尔大学,本研究以黑龙江省中西部地区三所高校大学生为目标群体，以生命价值观为中介变量对其在核心自我评价与挫折承受力间的中介作用进行了考察。通过对个体的生命价值观和核心自我评价进行探讨，能够深化人们的了解，为从本源上探寻提高挫折承受力的解决途径提供了有用的启示信息。
大学生职业生涯目标缺失与社会支持相关研究报告,教育,福建医科大学,本研究随机抽取的福州高校大学生为被试，同时运用修改后的“肖水源社会支持量表”与自编问卷“大学生职业目标调查问卷”进行测试，对所得数据结果进行描述性与相关分析。结果显示：○1福州大学生的社会支持在年级、是否为独生女子女方面存在差异○2大学生的职业目标缺失状况与社会支持存在负相关。并且针对研究所得的具体情况，对大学生职业生涯目标的规划从自身、家庭、学校、社会四个方面提出了相关对策和建议。
关于大学生自主创业的调查报告,教育,西南林业大学,大学生就业难的问题日益严重，成为人们关注的热点问题，国家也相继出台了一系列促进大学生就业的政策，其中提到大学生自主创业是就业的重要增长点。大学生自主创业调查采用问卷的形式进行，通过描述性分析和列联分析等统计方法，对云南省五所大学的大学生自主创业现状、看法与意向、优劣势、创业教育需求和创业素质等进行了深入分析，并针对研究中发现的大学生自主创业中存在的主要问题从教育层面提出了建议。
关于东陈村留守儿童教育问题调查报告,教育,山东科技大学泰山科技学院,留守儿童教育问题，通常是指狭义上的学业教育问题，实际上还包括基本权利保障问题、学习问题、生活问题、心理问题等等，是多种矛盾与冲突综合性的客观体现，涉及到诸如社会制度、经济发展、家庭结构、学校教育等一系列社会失调现象。通过文献回顾、个别访谈和实地调查等分别从家庭、学校、社会、政府等多个群体的角度分析了当前农村留守儿童教育中存在的问题，并对形成这些问题的原因进行了分析，针对性的提出了具体的解决方案。
锦州市城市农民工子女受教育状况的调查研究,教育,辽宁工业大学,"目前，伴随着锦州市城市化建设对劳动力的需求增大，越来越多的农民工和其子女涌入城市，成为锦州市一个特殊的群体。近年来，锦州市政府大力发展教育，使得锦州城市农民工子女的受教育数量、程度等方面不断提高。但是，锦州城市农民工子女受教育存在的问题也日益凸显。关注和解决他们受教育问题，是社会普遍关注的重要课题。作品通过对锦州市城市农民工子女受教育状况的调查研究分析，指出其存在的问题,提出合理化建议。"
特殊教育教师个人教育观念的叙事研究,教育,安顺学院,本文运用叙事研究的方法，以一位特殊教育学校教师作为研究对象。通过建构一组研究对象的教育教学故事，展现研究对象个人教育观念的具体实践形态，在具体故事的深入描述和详细的分析中尝试对研究对象个人教育观念的内涵做个人的评析。通过评析研究对象的个人教育观念，提出优化特殊教育教师个人教育观念的几点建议。
从新疆高校少数民族大学生“五观”调查看新疆青年马克思主义者的培养,教育,石河子大学,本课题以对新疆高校少数民族大学生的“五观”现状调查为基础，进行青年马克思主义者培养的研究。通过对相关研究对象的问卷调查和访谈，对新疆高校少数民族大学生对马克思主义的认知现状进行归因分析，并最终为新疆高校少数民族大学生青年马克思主义者培养路径提供一定的对策和建议。
关于山西省农村基础教育投入的调查与分析,教育,山西大学商务学院,随着近年来国家对农村基础教育的大力扶持和山西省本身经济水平的提高，山西省各地市政府在财政性教育支出上有了绝对量的增加，山西省农村基础教育现状却不容乐观。 对山西省十一个地市的关于山西省农村基础教育投入问卷调查，得出我省农村基础教育发展中存在着整体性薄弱、教育落后等问题，要改善农村基础教育的现状必须多方着力，采取切实有效的措施，规范农村基础教育的财政投入，提高农村基础教育。
哈尔滨市外来务工人员随迁儿童受教育状况调研报告,教育,哈尔滨工业大学,为了研究哈尔滨随迁儿童受教育问题，该团队对2954份有效问卷进行科学的量化分析，从五个维度揭示了哈市随迁儿童受教育现状，充分肯定了哈尔滨在政策实施、教育管理等方面的优势，也发现依然存在诸如政策局限、资源分配不公、宣传不到位等不足，并相应提出了户籍改革、教育资源配置和加强督导等针对性建议。该项目是首次从大学生视角全方位的关注哈市随迁儿童的教育问题，研究方法科学合理，内容贴近当前社会热点。
老少边穷石漠化下的教育守望,教育,云南师范大学,扶贫开发是教育发展的前提，教育发展反过来又是扶贫开发的推进剂和辅助器。而关注和守望边缘化地区的教育问题，也是当下追求教育公平这一时代命题下不得不正视的现实问题。基于此，本作品以老少边穷石漠化下的教育发展现状为研究框架，具体以滇桂交界连片特困地区为研究视角，通过调查该地区的教育发展现状、制约教育发展因素、面临问题，并提出相应的对策建议，旨在为我国当下在边缘地区的扶贫开发与教育发展提供借鉴参考。
民间艺术的抢救、活化及其在美术教育中的应用,教育,上海师范大学,本研究以民间艺术在当代美术教育中的作用为切入点，通过对糖画艺术的学习与调研，一方面参与到民间艺术的创作中，探索民间艺术在美术教育中的应用与方法；另一方面客观上做到了对民间糖画的抢救与活化，对民间糖画的创作工艺、基本图样进行了影像化的记录与研究，并对其进行创新与艺术化，进而以推动其进入中小学美术课的形式令其重新焕发活力。研究说明学习民间艺术能够促进美术专业学生创造力的提升和民族文化修养的加强。
培养当代中国孩子的领导力,教育,华东师范大学,新世界的到来、社会的进步、生命的完善，都呼唤着领导力的培养。在处于和平崛起和深度转型的当代中国，这种需要尤为迫切。本作品力图探究学生领导力培养的中国经验，通过对上海、常州等地中小学的问卷分析和深度访谈，在广泛阅读和深刻反思中，理性而务实地提出了包含策划力、实施力等为核心的领导力结构，分析了当前学生领导力培养的问题与可能，梳理出了具有中国特色的学生领导力培养路径，并对相关教育工作者提出了建议。
体育与下一代：我国青少年体育发展研究报告,教育,成都体育学院,青少年是人类的未来，肩负着国家的未来与希望。近20年来，中国青少年群体的健康状况令人担忧。中国政府高度重视青少年体育问题，先后出台了一系列法律法规，为青少年体育法制化、规范化的提高做出努力。正是基于这一现实需求，课题组以当前中国青少年体育发展情况作为研究对象，进行了大量的调查和研究，探寻现实中的问题根源，并在此基础上提出有针对性的对策和建议。
推进基础教育均衡化发展,教育,厦门大学,本项目基于厦门市基础教育改革的实证分析，研究推进基础教育均衡化发展的供给机制问题。厦门市思明区经在基础教育改革实践中，小片区管理模式、学校标准化建设、进城务工人员随迁子女入学等方面卓有成效。也存在需要进一步改善的地方。基础教育的均衡化，尤其是高位均衡尚未实现；优质的教育资源仍然稀缺，家长之间存在的潜在的竞争中；特色教育、素质教育任重道远。选择与竞争的入学机制为下一步行动提供了可能的选择。
网络使用对小学生心理健康影响的调查研究,教育,安康学院,现今，网络环境对小学生心理素质的影响，是影响未成年健康成长的重要组成部分。随着互联网的逐渐低龄化、以及其在低龄人群中的娱乐渗透性，也成为人们担忧的焦点，网络中潜在的不良环境也潜移默化的影响小学生脆弱敏感的心理。作为教育专业的大学生，我们希望能够对小学生这一特殊群体进行分析，了解小学生对网络依赖的程度等方面以及找出网络环境下小学生心理健康维护的有效途径和方法等，促进小学生心理健康的全面发展。
西安市学前教育满意度调查研究,教育,西安邮电大学, 众所周知，学前教育作为一项国民教育中的基础性教育，对幼儿的长期发展起到了铺垫作用。出于让幼儿不能输在“起跑线上”的考虑，越来越多的父母逐渐重视幼儿的幼儿园的教育问题。但是，由于幼儿园办学质量和水平多种多样，为幼儿提供的服务存在着问题。所以，我们就幼儿园的教育进行了一项满意度调查。通过深入研究，发现西安市学前教育存在的问题，并就这些问题提出解决的对策，为政府提供参考性建议。
医学生到基层医疗机构工作意愿及影响因素分析,教育,宁夏医科大学, 为了解医学生到基层医疗机构工作意愿，筛选分析影响医学生到基层医疗机构工作的因素，本研究针对高等医学院校学生进行基本调查，通过对学生基本情况、专业学习、所接受的培训、影响医学生到基层就业的因素等指标来分析医学专业毕业生是否愿意去基层医疗机构工作及主要的影响因素。针对这些主要因素提出相应的建议和意见，为引导大学生到基层医疗机构工作提供理论依据和政策建议。
粗放与集约？土地规模经营对粮食增收影响的研究,经济,西南大学,本研究以经济学、社会学等多学科的理论为视角，通过对山东青州土地规模化经营的实地调研，基于学者的前期经验研究，分析了当前农村土地适度经营过程中取得的成绩、存在的问题，剖析了主要原因，并以此为逻辑起点提出了一些针对性的对策建议，这对培养新型经营主体，加强城乡互动，以城带乡切实推进新型城镇化发展，加快社会主义新农村建设，促进工业化、信息化、城镇化、农业现代化协同发展，具有重要的现实意义。
当前经济条件下县域中小企业融资现状及对策分析,经济,武汉科技大学, 作品以湖北省150家和江苏省122家县域中小企业问卷调查数据为基础，结合实地走访、座谈获得的信息进行深入研究。结果显示，融资能力与区域经济发展水平、产业集群程度、企业规模、企业年龄等因素成正相关关系。区域经济发展水平越高、产业集群程度越高、规模越大、成立时间越长企业融资越容易，反之则越难。此外，经济条件较好地区的企业融资成本普遍低于经济条件较落后地区。
地方财政支农支出对农业技术效率影响的实证研究,经济,新疆农业大学, 本文使用中国31省市的2000～2011年的面板数据，运用基于对数型柯布—道格拉斯生产函数的随机前沿分析模型实证研究了地方财政支农支出对农业技术效率的影响。结果表明：增加地方财政支农支出可提高农业技术效率；同时农业技术效率也因地域差别呈现出显著性差异，其中东部地区农业技术效率远高于全国水平及中西部地区，建议地方政府应加大对中西部地区各省的财政农业支出。
个人所得税视角下“仇富心理”的成因及治理对策,经济,长沙理工大学,本项目是基于当前社会“仇富心理”日益凸显，个税改革成为热议的背景下提出的。通过调查研究发现，巨大的贫富差距是“仇富心理”产生的主要原因，社会分配制度、竞争机制的不公平是“仇富心理”产生的根本原因。本报告从个人所得税体制的立法、执法和纳税人三个方面提出了三方双向循环体系，即个税立法环节、个税执法环节和纳税人自身方面三方相互监督，相互协调的体系，在一定程度上有效的解决了个人所得税现存问题。
加快建立城乡统一的建设用地市场,经济,福建师范大学, 建立城乡统一的建设用地市场作为一种制度创新，对于打破城乡二元结构、推进城镇化具有重要意义。然而现阶段尚无成熟的经验和模式，需要在实践中不断完善。以十八大报告提出的“推动城乡发展一体化”方针为指导，我们就厦门市集美区的集体建设用地流转情况展开调查，分析其存在的问题和原因，在此基础上提出构建市场的基本思想、基本原则、基本步骤及政府对市场的宏观调控，为建设用地市场的运行提供对策建议。
沈阳市公交服务体系现状调查及改进方案,管理,沈阳建筑大学,第十二届全运会将在辽宁省举办，沈阳将加快经济区的规划和建设，深化经济区综合配套改革的步伐，大力保障和改善民生。而作为当代大学生，我们也应以良好的精神状态和饱满的姿态来积极支持全运。借此契机，我们对沈阳公交车系统进行了调查和研究，旨在通过实地调研和分析，提出建议和相应的解决方案，为建设沈阳城市交通做出我们的贡献。
农村产权制度改革中的基层民主建设与社会福利分配,经济,北京大学,成都农村产权制度改革一直是多方关注的焦点，本作品以改革中新成立的“村民议事会”为主要分析对象，采取理论与实证相结合的研究方式探究了这种变化对于基层民主建设与社会福利分配的作用。同时，在上述分析的基础上进一步探索了这种制度在经济学与政治学中的优势所在，对未来深化改革、进一步增加农村的社会总福利和土地收益率提出了课题组的观点。
农村土地抵押融资的实践、制约与对策,经济,湖南大学,本研究根据转型时期发展农村产业化、规模化和城乡一体化的新形势，采取实证和比较分析研究的方法，实地探访了湖南省多个试点县市，通过问卷、人员介绍等多个方式深入了解当地农民资金需求和对土地抵押融资的态度及基层金融机构从业人员所面临的处境，并根据所调查搜集到的数据、资料，简要分析了农地抵押融资的现实困境与制约因素，阐述了推进农村土地承包经营权抵押的重要性和紧迫性，并从多方面提出了实现路径和具体对策措施。
陕南移民经济状况与相关政策的评估研究,经济,陕西师范大学,陕南移民搬迁计划十年，斥资千亿，改善60万户240万灾民和贫民的生产生活条件。为丰富我国自愿性灾害移民研究，推动移民搬迁工程的顺利开展，我们在汉中、安康、商洛三市展开调研，依靠调查资料的定量分析与访谈资料的定性分析，从经济学角度出发，以收入、消费、储蓄、就业等为着力点对比分析陕南移民家庭搬迁前后的经济状况，透析其变化原因，评估政府有关经济政策的实施绩效，发现问题，提出建设性的政策意见。
实施居民收入倍增计划的制约因素与对策研究,经济,湖南大学,本文立足于经济热点问题的研究，首先利用面板数据模型对我国宏观经济数据进行实证探究，并根据深入长沙、常德、永州三个城市及乡村进行实地调研的结果，综合实证和实践的数据分析结论，总结出提高居民收入的制约因素，为居民收入倍增计划的推行夯实理论和现实基础。本文主要以湖南省为例，针对提高居民收入的制约因素提出切合实际的对策建议，为真正实现中低收入者的收入倍增进言献策。
物美价廉的蔬菜供应链建设与升级探索,经济,中国石油大学(华东),消费者在购物时多讲求“物美价廉”，可是近年来蔬菜价格呈现波动上升的趋势，“有毒蔬菜”的屡次曝光更让人们惊心不已。报告首先深入了解山东省蔬菜供应链的发展历程，总结出三种主要模式；接着对山东蔬菜供应链的运行与管理状况进行实地调研，总结出其运行管理的优点与不足；然后对山东省各级政府完善蔬菜供应链建设所做的工作进行总结；最后提出基于SCOR模型的蔬菜绿色供应链，保证蔬菜产业健康发展。
新疆少数民族贫困地区扶贫开发与农户参与研究,经济,石河子大学,新疆贫困问题具有重要性以及独特性的双重特征，贫困农户尤其是少数民族贫困农户能否通过参与扶贫活动实现脱贫是解决新疆贫困问题的关键所在。基于以上情况，本项研究利用新疆贫困地区3000户农户的入户调查数据，借助Logit回归模型，对影响新疆贫困地区农户参与扶贫活动的因素进行了计量分析。通过对计量结果进行的分析，发现了影响新疆贫困地区农户参与扶贫活动的关键所在，结合理论与实际提出了多条可行性建议。
呼和浩特市打造我国“云谷”的前景与对策探析,经济,内蒙古师范大学,本文从产业结构的角度分析呼和浩特打造“云谷”的背景、前景、优势条件，并提出打造呼和浩特”云谷”的政策建议，把呼和浩特打造成为我国的“云谷”中心。内蒙古师范大学盛乐校区，位于和林格尔县盛乐经济园区，毗邻盛乐云计算产业园区。内蒙古自治区急需进行产业结构优化升级，这是一个大背景。2013年4月，为云计算电压测试，学校停电三次，由此有感而写，建设呼和浩特云计算中心想法。“云谷”，“草原硅谷”。
基于生态西藏背景下西藏林芝地区鲁朗国际小镇建设的探讨,经济,西藏民族学院,鲁朗在藏语中是“神仙居住的地方”，其得天独厚的旅游资源是鲁朗的宝贵财富。西藏林芝地区应该与时俱进，抓住当前国家大力打造西藏成为国际精品旅游目的地的机会，把鲁朗的神奇资源应该转化为现实的财富，以建设国际生态旅游小镇为契机，以“村寨接待模式”，大力发展当地特色的生态民俗文化旅游经济，在实现当地的经济发展和生态保护相统一的基础上，从而提高人民的生活水平。
农民专业合作社：探索、困境与出路,经济,青岛理工大学, 基于对“青岛龙马农产品专业合作社”的实地调研，报告从运营模式、运行效果等方面系统考察其发展历程，并深入分析发展困境与契机；然后借鉴“日本农协”及“美国新奇士桔农协会”经验，结合龙马合作社本身特点与发展实际，并中央一号文件鼓励和支持“家庭农场”发展的契机，提出拓宽业务范围、组织联合模式及在产品与管理等方面的创新是其根本出路，并从政府与合作社两个层面分别提出相应的对策建议。
