[作品信息]作品名称,院系,[类别信息]高校,(哲学社科类)[作品信息]简介
“失独”余生，不再孤独一生 ,社会,中国青年政治学院,该项研究以“第一代失独母亲”为研究对象，结合现今社会现实与人口政策相关背景，通过在武汉相关地区的实地调研和对“失独群体”自救组织深度访谈的方法，深入了解个体的内心世界与真实诉求，结合社会资本的理论科学地分析该群体的生存与发展，并有针对性的提出相应的解决对策与建议。
保护迁徙的天使,社会,苏州大学,流动儿童因同城医疗保障待遇的缺失，在医疗保障政策盲区中“赤裸生存”。流动儿童死亡率远高于城市儿童，1-14岁流动儿童的医疗保障问题已然成为城市诟病。项目组深入流动人口集宿地、儿童医院等实地调研、与政府相关部门官员、医务人员、人大政协委员面访谈，专家咨询，总结苏州具有全国先导和示范意义的“流动儿童基本医疗保险制度”与运行模式的成就和经验，对其他各城市的发展具有较好的参考、借鉴以及启发意义。
残疾人托养现状与分析,社会,南京特殊教育职业技术学院,本文以“江苏省残疾人托养现状”为调查主题，对江苏省不同地区、性质、形式的省级示范残疾人托养机构进行了一系列的综合实践调查。希望通过这次调查来了解江苏省残疾人托养机构的现状，以期为“两个体系”建设，提供一些借鉴，从而为不断提高江苏省残疾人托养服务水平提供一些现实依据和决策参考。
城市历史风貌区社区更新矛盾研究,社会,南京大学,在我国城市化转型过程中，用地开发已从增量空间逐渐转向存量空间。南捕厅这类社区既是一般意义上的“旧城区”，又涉及历史文化保护问题，因此更新矛盾十分突出。本次研究沿着社区空间特征和利益主体两条线索展开，调查其矛盾现状与特点，剖析矛盾形成原因与核心。进而将带有历史风貌区特征的社区更新过程一般化，提出社区更新动态循环模型作为解决矛盾的思路。最终总结出可推广、可操作的历史风貌区社区更新方法。
城市社区中医药服务现状及对策研究,社会,安徽中医药大学, 为了解城市社区中医药服务现状，为基层中医药的进一步发展提供一些详实的数据和可靠的依据，以安徽省部分城市为例，历时二年，利用临床专业社区卫生实践月、暑期“三下乡”和节假日等机会，选择了安徽省合肥市等七个专题调研地和亳州市等十个抽样调研地共24城市社区进行抽样调查。通过实地调研城市社区中医药服务，分析了当前存在的问题及其成因，并依此提出了针对性的对策建议。
迟暮之年，何处安放？,社会,中国人民大学, 近年来，一个特殊的群体——失独家庭正慢慢走入人们的视野。针对此问题，本文旨在从供求关系入手，通过对政府帮扶机构与自助机构的SWOT分析与相互比较，具体分析各自的现状及二者的差别，以及系统研究帮扶机构的供给情况；同时采取与失独父母深度访谈的方式了解失独父母的具体需求，最后探究供需关系的匹配情况，发现供需匹配的缺口所在，并在此基础上提出具体可行的对策和建议。
春运摩托车返乡潮现象的形成机理、安全风险及对策研究,社会,桂林电子科技大学,针对春运摩托车返乡潮现象严重的交通安全隐患和高昂的出行成本问题，综合采用现场问卷调查、平安往返有偿联系卡、电话回访、车速检测和网络搜索等手段采集基础数据，解析该现象的形成机理和事故风险机理。以此为基础，以最小的代价，针对形成机理研究源头上的化解对策；对于无法化解的，针对安全风险研究降解对策。成果对减少春运交通事故，增进社会幸福，关爱弱势群体，促进社会和谐，有着特殊而重要的现实意义。
从脚下，到远方,社会,华南理工大学,调研从进城务工青年、城镇居民和行政村三方面入手，通过走访和发放问卷的形式，深入调查这一群体的生存现状和发展前景。借鉴公共政策评估研究和相关文件，综合运用管理学、经济学、社会学和政治学等，以调查进城务工青年的基本生活情况与社会保障、心理健康与身份认同现状为依托，寻找融城难的症结，并提出相应的政策建议，加速城市融入和市民化进程，从而推动城乡经济与社会和谐发展。
从乡村到城市：统筹城乡背景中新市民的社会融入研究,社会,西南大学,本研究在统筹城乡的背景下，对重庆市及成都市2158名农转非新市民进行了实地调查，采用问卷法、访谈法等方法，探究这些已经突破户籍制度阻碍的新市民的社会融入状况。构建理论模型，探究社会比较、社会距离、满意度以及元刻板印象对社会融入的影响，运用中介变量分析、二元Logistic回归等方法科学地分析了新市民的社会融入状况，进而为成渝地区统筹城乡的相关政策提供针对性建议，以促进新市民的社会融入。
东部城市少数民族机构养老现状探析,社会,南京理工大学,《社会养老服务体系建设规划（2011-2015年）》提出，到2015年，机构养老床位要达到每千名老人30张，而目前即使在东部地区，每千名少数民族老人拥有的床位数平均仅10张。本作品基于少数民族特殊的养老需求，对京宁汉三地的四家少数民族养老机构进行研究，分析其运营现状，总结归纳其特点与问题，并提出少数民族机构养老多元化发展策略。作品有利于促使相关部门关注少数民族机构养老现状，促进和谐社会建设。
都市庄客：城郊“农民农”群体的边际生存与发展对策研究,社会,华东师范大学,随着中国城镇化进程的加速，越来越多的“农民农”进城务农以填补由于城市农民退出所形成的都市农业空白，他们蜗居于城郊一隅，承担着城市农业生产与农产品供应的重要功能，却极少受到关注。本研究依托实证调查收集资料，全面揭示“农民农”群体在地域空间、经济地位、职业身份、社会网络和社会心理等五个方面的生存状态的特征和问题。在此基础上，提出改善“农民农”群体生存现状的对策建议。
对失独家庭扶助方式探索的研究,社会,中国石油大学(华东),课题组发起成立“服务失独”青岛高校志愿者联盟，组织246位调研员，走访地点48处，总行程达33000余公里，整理得到失独者数据表209份，与部分失独家庭结成一对一帮扶对子；走访政府相关部门，与社会学等学科25位专家进行访谈；与2013年两会中联名提出失独家庭提案的全国人大代表宋心仿和李绍霞讨论，得到其肯定，并参与其再提案过程，对完善中国特色社会主义社会管理体系具有重要意义。
非营利运营，传递社会养老正能量,社会,南京财经大学,社会人口老龄化的来临给我国的养老问题带来极大挑战，公办养老院远不能满足社会养老需要，急需民营养老院的快速发展。但是民营养老院在创办和运营管理过程中遇到很多“瓶颈”因素制约。为进一步促进、规范民营养老院发展，本课题组在南京市鼓楼区民政局的大力支持下，立足鼓楼区民营养老院的发展现状，通过实地走访调研，深入挖掘制约民营养老院发展的深层次因素，并进一步探讨推动民营养老院在数量和质量上健康发展的对策性建议。
封闭管制还是开放协商,社会,吉林大学,本文阐述了XX大学学生服务团队在吉林省吊水壶村，针对群体性社会冲突，协同社会管理的实践历程。学生团队通过自身的参与和协同，构筑出以“党政引导、大学协同、企业扶持、村民参与”为基本框架的“四方共建”平台，以此化解社会矛盾，促进当地和谐发展，并实现政府、村民、企业、高校的四方共赢。三年多的实践证明，“四方共建”平台不仅具备有效性和推广性，还实践了社会管理模式由“封闭管制型”向“开放协商型”的转换。
构建和谐社会的新创举,社会,华侨大学,在社会转型的背景下，国人难以适应社会变化的状况，精神健康问题日益突出。情感护理解析人们的情感困惑，缓解精神压力，能有效护理情感，是保障社会大众精神健康的基础性工作，有助于构建和谐社会。本研究实地考察深圳市市民情感护理中心，运用文献述评、参与式观察、面对面访谈、数据分析、电话访问和跟踪调查等方法，对其深入分析，总结其成功经验和实用举措，客观评析其实践成效和推广价值，并针对其面临的问题提出相应对策。
关于与农民切身利益相关的几个档案问题的调查研究,社会,辽宁大学, 本调查报告以档案工作的视角从农民工个人档案的情况、农村土地档案和农村档案管理现状等方面，结合中国共产党第十八次全国代表大会报告的中心思想，以辽宁省沈阳市沈北新区的农村和社区为主要调研对象，展开实地考察。重点调研了虎石台新苑村、柳条河村、三井社区，反映了一定的现实状况与问题，期以强化农村档案工作在党和国家的农村政策实施过程中的作用和地位，完善农村档案工作的建设，帮助农民解决相关切身利益问题。
关于中高年龄段失独家庭再适应问题的调查,社会,安徽大学,伴随着国家计划生育政策的深入实施，学术界对于独生子女群体的关注与日俱增，但对于独生子女死亡这一分支的研究几乎没有，失独所带来的一系列问题也没有的得到很好的解决。对此，本文通过对安徽省四地中高年龄段失独家庭调查研究，创新性的提出了“4+1”帮扶模式，解决失独家庭面临的家庭内部和社会外部两方面的再适应问题，即社会再适应问题，并在物质和心理两种层面实现对失独家庭的有效帮扶。
国内SNS移动社交的发展现状及趋势 ,社会,西安工程大学,社交网络的移动化近两年来发展迅猛。它因其广泛的社会影响和潜在的商业价值备受网民及商界人士亲睐。这种新兴事物因其发展过于快速，少有人进行专门的研究。我们本次调查通过仔细研究和模型构建，将目光聚焦在移动社交的用户，产品，以及社会影响等方面因素。从而达到剖析移动社交在网民中的现状，并对其做了简单的发展趋势预测。
和谐湖南背景下的医患关系现状的调研,社会,南华大学,在医疗体制深化改革、医患双方自主意识加强、医疗纠纷频频发生的背景下，该作品以了解现今医患关系对和谐湖南的影响为目的，以衡阳市为例，在查阅相关文献的基础上，从医务人员、非医务人员、医学生等的视角设计了相关问卷，对衡阳市相关综合医院和社区医院、南华大学、某居民小区等单位进行随机抽样调查。结合走访、个案访谈等方式，采用相关软件对调查数据进行统计对比分析，得出了一系列衡阳医患关系的最新数据和资料。
湖北省农村留守儿童社会化调研报告,社会,黄冈师范学院,本研究立足于“曙光”行社会实践团队，编制调查问卷进行了丰富和详实的社会调查，并在此基础上深度访谈了相关专家和学者、一线管理人员和一般民众，在问卷和访谈的基础上开展案例调查和分析，通过问卷、访谈和案例分析三者相结合全面分析湖北省农村寄宿制学校留守儿童的社会化状况及影响因素，揭示存在的问题并剖析原因，提出解决措施。项目成果可以为政府全面了解和掌握农村留守儿童状况提供参考数据。
环境治理中ENGO的作用及发展趋势探讨,社会,江南大学,团队组建于2012年4月，选题方向确定为环保公益组织（ENGO），通过科学理性的调研，得出苏南地区ENGO现有状况的真实数据资料，探讨内在规律，弥补此领域研究空白。在文中提出的四种模式实为理论与实践结合的产物，有广阔的应用前景。这对于我国在今后的环境治理过程中，具有建树性意义。兴之所至，心之所向，在今后的学术研究中，对于作品我们还将继续不断完善，以求为社会及学界服务。
夹缝中的第三身份,社会,山西大学,本作品在列斐伏尔“空间的生产”理论假设下，采用问卷调查和深度访谈相结合的研究方法，对晋豫两省T市和Z市的拆迁安置社区进行调研。在对制度安排考察下，探究在城市化过程中非自愿性地被纳入城市的“新市民”，是如何在剧烈的社会变迁下建构现代城市价值观、实现身份认同的。基于对605份有效调查问卷的统计分析和55次深度访谈记录的个案剖析，揭示新市民身份认同困境及建构路径，提出促进城市化内涵发展的可行的政策方案。
静悄悄的结社革命,社会,湘南学院,社区民间组织是当代城市社会建设的新杠杆，是中国现代化建设的重要基础。笔者调研了解到目前湖南城市社区民间组织的发展存在组织化程度不高、自主性较差、运作绩效欠佳、管理虚化及发育市际失衡等困境，而致使湖南城市社区民间组织发展陷入困境的重要因素是政府介入方式失当。综上所述，培育城市社区民间组织，要健全法律政策体系，夯实民间组织培育的制度保障；加大公共财政投入，采用社区项目制，推进工作者队伍建设。
廊坊市城市人口幸福指数调查及对策分析,社会,北华航天工业学院,通过调查廊坊市城市人口的生活、工作、居住环境、收入等现状，分析廊坊市城市人口的幸福感水平及其主要影响因素，并为政府部门提出可行性对策。 课题响应党中央提升人民幸福感的政策，并锲合“幸福廊坊”的城市名片，具有时代气息和现实意义。首先对廊坊不同层次、不同职业的市民进行访谈，并归纳出影响廊坊市城市人口幸福感水平的因素，并用层次分析法对其幸福指数水平进行量化分析，找出影响因素。
老龄化背景下养老设施软硬件并行发展模式研究,社会,西安建筑科技大学,本文在养老设施理论分析和经验研究基础上，对西安市养老设施的软硬件供求现状与应用情况展开调查。通过对西安市十家养老院问卷调查及访谈，及对数据和资料的研究与分析，发现养老设施软硬件供求失衡与发展不配套的问题，在深入分析其产生原因的基础上，调查组创新性地提出养老设施软硬件并行发展模式及其可行性对策，并制作了养老设施软硬件并行发展模式掌中宝典进行该模式的实践与推广。
黎锦文化处境田野调查报告,社会,海南师范大学," 本文从黎族女性的角度切入，使用质的研究方法进行材料的整理、分析，从而将黎锦文化处境真实的展现出来。文章第一部分为黎锦文化意蕴的解读,分别从生活、教育两个层面来解读黎锦的文化意蕴。第二部分为当下黎锦文化处境的分析,通过我们前期实际的走访调查,加之后期的分析得出的当下黎锦文化处境的状况以及相应的措施。"
利益调整与制度变革,社会,华中师范大学,立足于对温州2000多位新居民和原住民的深度调查，本项目从经济、社会、制度和文化等方面对温州社会融合状况展开评估，并结合新时期温州推行的地方改革创新与经验，分析当前阻碍社会融合的重难点，把握当前改革趋向，指出未来的社会融合发展应是“平等地融合”，并为此提出了相关的“二维四象限模型”及新时期构建共有家园的具体路径。为进一步推进城乡综合改革，创新社会管理，实现流动人口的社会融合提供理论和政策支持。
流浪儿童何以“流浪”,社会,上海大学,新疆流浪儿童作为一个社会弱势群体却一直受到社会的谴责和唾弃，背井离乡的他们除了偷盗就没有了在内地生存的手段了吗？ 本研究就是从新疆流浪儿童出走与流浪方式选择的成因分别展开研究，得出新疆流浪儿童特有的成因并根据实地情况展开对策研究。
留住城市的声音,社会,上海外国语大学,追溯沪语历史，探究沪语对社会、文化、城市的影响，以在沪居民眼中当今沪语的生存现状调查为切入口，采访多位沪语领域知名人士和新、老上海人，分析不同人群使用沪语的现状，得出沪语日渐式微的结论，从社会和文化层面分析沪语衰落的原因，借鉴世界他国大城市保护方言的举措，分别针对上海本地人和新上海人提出传承沪语的对策，为上海更好地塑造成为一座多语言海纳百川、和而不同的城市提出具体可行的建议。也能裨益中国其他方言。
鲁西地区农村“留守老人”养老状况的调查与分析,社会,聊城大学, 以政府对农村老人养老保险的实施情况为基础，以山东省聊城市为例，通过调查全市各县、镇留守老人的基本养老状况，调查研究留守老人的现状对新农村建设的重要影响。比较研究留守老人与非留守老人的老年生活情况，发现留守老人在生活等诸多方面的问题，重点分析农村老人的生活水平、医疗保健、精神生活状况等，对比研究农村留守老人与非留守老人的生活状况，对样本实例进行图表分析，为政府在新农村建设方面提供借鉴。 
民间公益组织发展现状及其机制健全研究,社会,西南民族大学,5.12地震后，我国民间公益组织蓬勃发展。课题组通过深入走访四川省内的民间公益组织，真实反映其运行现状。资金短缺、人才流失严重、公众认知度不足、公益心态不成熟等问题突出。结合实际，课题组提出了相应建议，如：创新资金渠道，健全管理机制，宣传方式多样化，建立健全慈善立法，加强公众参与。希望本社会调查成果能吸引更多的有识之士关注民间公益组织的发展，激发它们发挥更大的社会效用，推动整个社会的进步。
呐喊与彷徨,社会,华东政法大学,本文利用2012年在沪、浙、苏三省市进行的大型问卷调查数据，通过对同期群、人力资本、企业性质、个人经历等几个方面的描述，试图探索关于农民工维权意愿的影响因素。研究表明，法律认知、工作职位、单位制度化水平对农民工维权意愿具有显著影响，不同代际之间的农民工维权意愿有明显差异，总体呈“V”型分布。报告进一步探讨了农民工维权渠道不畅通、维权成本高等现实性问题，并就相关政策的制定提出了建议。
南水北调移民与当地居民社会交往实证研究,社会,郑州大学,随着南水北调中线移民工程的逐步实施，移民在迁入地的各种社会问题日益暴露。通过对河南省淅川籍移民在迁入地与当地居民社会交往现状的调查，发现与搬迁前相比，南水北调移民的社会交往水平整体下降，尚未融入当地社会。而制约移民社会交往的因素分别为婚姻状况、文化程度、贡献评价、收入水平和社会支持。在此基础上，以“社会驱动”为理念，设计了一套社会网络支持系统作为建议模型，以图改善移民的社会交往现状。
农村公共文化服务供需状况与满意度,社会,南昌大学,本文基于保障公民基本文化权益的视角，采用定量分析和定性分析、实证研究和规范研究相结合的方式，深入考察了农村公共文化服务供需状况与农民对其的满意度情况，科学且深入地揭示农村公共文化服务供给过程中存在的问题及其形成根源，最后针对农村的既有特质和实际情况提出针对性对策建议并建立农村公共文化服务供给理想模型，为决策者和政府部门保障公民基本文化权益、建立健全公共文化服务体系和推进公共服务均等化提供参考。
破解资源型农村治理困境，路在何方？,社会,山西大学, 本文从资源型农村的现有特征出发，通过对甲乙两个资源型村庄的对比分析，探究了甲村治理困境的实质以及乙村良性发展的原因。从两个特殊案例中提炼出适用于一般资源型农村发展的规律，进而突破资源型农村的治理困境，为资源型农村的发展找出路，为全省乃至全国资源型农村的可持续发展提供有益经验和借鉴。
区隔与融合：新农村建设中移民新村的社会网络与建构,社会,上海大学,本文用分析礼簿的方式，第一次将礼物交换行为定量化，数字化。用社会网络可视化技术分析传统中国的送礼现象。在新农村建设的背景下，用礼物交换网反映“移民新村”的社会网络与建构，进而反映移民之间以及移民与原住地居民的社会融合现状。发现移民过程的一种现象:原住地居民和移民之间形成“在区隔中融合，在融合中区隔”的规律。对新农村建设的推进有重要参考价值。
全民健身：政府“盛宴”与城市居民困惑问题审视,社会,泰山医学院,通过对山东省全民健身运动及全民健身服务体系建构现状进行社会调查，对取得的成绩、存在的问题进行全面剖析，认真审视和评估全民健身“盛宴”与城市居民健身锻炼面对的现实困惑，结合团队成员主动参与全民健身志愿服务与社会实践，结合体育部门接纳调查研究建议与意见情况，从宏观与微观的视角，研究如何推动全民健身运动，建构全民健身多元服务体系的理想模式，为山东省全民健身的改革与发展提供理论思考和决策依据。
让世界文明种子在中国生根开花,社会,河南工业大学,简而言之，时间银行就是借鉴商业银行存钱、取钱的运作机制，使会员存进服务时间、取出服务时间的半官半民性组织机构。之所以称之为半官，是因为时间银行基本上都是由社区居委会在操作、在管理；之所以称之为半民，是因为时间银行根本上还是一种自发形成的民间组织机构。同时，与粮食银行一样，时间银行名为银行，实际上不是银行。
乳制品安全危机背后的“信任力量”,社会,中南大学,本项目立足于乳制品“信任危机”，以消费者信任为切入角度，通过定性与定量相结合的方法，探索乳制品消费者信任的提升之道。在调查过程中，项目团队对乳制品消费者消费信任的现状进行了全面、系统、客观的展现，分析了影响消费者信任的多维因素，对乳制品生产流通过程中各相关主体的作用机理进行了深入剖析与讨论，并针对存在的问题和问题产生的原因提出了独到的见解，以重塑信任为纲领，破解乳制品安全危机。
社会工作视角下寄养家庭现状分析及问题研究,社会,郑州大学, 2000年以来，各地民政部门按照全国社会福利社会化会议的精神，结合本地实际，大力推动家庭寄养工作。河南省郑州市儿童福利院在2008年年底开始全面推行家庭寄养工作。本调查报告通过对郑州市三十里铺村进行问卷调查与访谈，深入了解寄养家庭当前生活现状及面临的问题，并对引发这些问题的原因进行客观详尽地分析，最终提出相应的建议，希望能够推动家庭寄养工作的有效开展，最终促进寄养儿童的健康成长。
生命不能承受之痛 : 关于失独现象的调研报告,社会,曲阜师范大学, 目前，失独者对多数人来讲还是一个比较陌生的词汇，国家对此的研究也几乎处于空白，然而此类家庭却以一个较高的比例逐年上升。 本作品通过调查“失独者”需求引起社会群体关注，分析失独者的现状并对结合其生活环境进行对比分析，保障失独父母的晚年生活，同时关注失独群体的心理健康，为其提供心理救助和精神支持。并基于现在的基本国情及山东省现状，提出参考建议和对青年大众发起公益倡议。
生命周期视角下群体性上访中关键性少数的调查研究与仿真分析,社会,东北财经大学,本文调查了C市高架桥挡光引发的群体性上访事件。文章采用判断抽样、人格量表和深度访谈，调查政府人员及上访居民近70人。本文的创新之处在于从时间维度给出群体性上访事件周期划分标准，分析了关键性少数在各阶段的作用；在空间维度上，运用复杂系统多主体建模，结合格兰诺维特的“门槛”理论，构建了基于Netlogo的仿真平台，模拟了访民相互作用而形成群体性上访事件的过程。最后，本文结合仿真实验结果提出政策建议。
