[作品信息]作品名称,院系,[类别信息]高校,(哲学社科类)[作品信息]简介
民生援建加快西藏新疆实现小康幸福梦,经济,暨南大学,2012年6月28日至8月28日，调研团队前往广东对口支援的新疆喀什、西藏林芝地区进行了62天的深度调研和采访，行程2万余公里，采访185名各族干部群众，总结出“以民生援建为‘龙头’，产业发展和智力支援‘两翼齐飞’”这一广东援疆援藏模式。该模式为西藏新疆跨越式发展和长治久安注入强大活力，为全国对口援藏援疆省提供有益借鉴，为国家统筹发展战略决策提供有益参考。
大调解：探寻社会矛盾纠纷的体系化治理,法律,宁波大学,当前社会矛盾频发，制度性解纷能力不足，必须探寻体系化治理方式。大调解是其中的典型，它是以人民、行政和司法调解为核心构建的联动机制，其特色是：采用自下而上的社会管理创新理念，积极发掘民间调解组织等“功能模块”，努力搭建“支撑平台”，合理形成疏导分流、衔接处理和监管保障的“运行路径”。本项目以宁波市江东区大调解运行实践为调研对象，探究大调解如何发挥社会矛盾体系化治理的效果。
地票制度中的农民权益保护,法律,西南政法大学, 重庆地票制度是城乡建设用地指标统合的一次重大尝试，然而在实际运行中，损害农民利益之现象日益凸显，保障农民权益成为地票制度中一个亟待解决的问题。本文以农民利益为出发点，通过对重庆忠县、北碚区等地的实地调查，将理论设计初衷与实际运行现状进行比对，分析地票交易产生的积极效应，探讨地票交易存在的问题及原因，提出完善建议，缓解城乡土地供需矛盾，为完善地票制度和统筹城乡发展献计献策，进而将地票制度推向全国。
公租房：法律与民生,法律,山东财经大学,作品从法社会学视角，以山东省济南市、潍坊市、东营市、德州市、枣庄市为样本调研公租房的建设、运营实施情况，通过对五市经验和问题的分析，特别是抓住公租房制度建设中的法律制度这一核心问题，从政府、市场、个人在场域中的竞争与合作的逻辑入手，剖析公租房建设现状和制度建设困境，发现了法律脱嵌的现状及法律如何嵌入的关键点，并进一步探索出相关立法建议并试拟出《山东省公共租赁住房管理办法》（建议稿）。
关于社区矫正禁止令运作、效果的实证研究,法律,上海政法学院,社区矫正禁止令是《刑法修正案(八)》中新规定的内容，是对管制犯、缓刑犯具体执行监管措施的革新。本作品经上海市司法局帮助，对上海社区矫正116例禁止令进行宏观的统计分析，同时走访上海各区司法局、司法所、社区矫正中心26个，涉及基层执法人员、服刑人员、中层管理干部96人。经实证分析，发现实务中禁止令的问题，并针对问题提出了可行性建议与方案，报告可为社区矫正禁止令的深入开展提供参考。
关注服刑人员 共建和谐社会,法律,重庆师范大学,本项目以社会支持评定量表、自尊量表、罪犯出监前重新犯罪风险预测量表，在安徽省马鞍山和重庆市监狱随机抽取服刑人员进行问卷调查。通过实证研究建立服刑人员再社会化功效的路径模型，明确其再社会化功效、社会支持及自尊的现状特征，探讨影响其再社会化功效的心理因素。从心理学视角关注服刑人员，对其及监管部门提出合理建议以提升监狱强制社会化的质量和水平，共建和谐社会，实现中国梦及中华民族伟大复兴。
监狱服刑人员心理状况与心理矫治工作的调查研究,法律,济南大学,服刑人员心理障碍和心理疾病发生率显著高于一般人群，这既是他们走上犯罪道路的重要原因，也是他们重返社会的主要障碍。本报告根据在山东省Z监狱长期的、大样本的调查和研究，全面分析了服刑人员的心理特点及心理矫治工作的现状，总结了监狱开展心理矫治工作的基本规律，提出了改进监狱心理矫治工作的思考与展望。本报告将为改进与完善我国监狱心理矫治工作，促进对服刑人员管教工作的科学化与人性化贡献力量。
建设工程表见代理纠纷的审判方法和风险防范研究,法律,清华大学,城镇化进程中施工挂靠、转包等违法经营行为泛滥，引发的表见代理纠纷成为关注焦点。由于立法简陋，纠纷同案异判现象突出，成为困扰当下司法界和建筑业的重大难题。报告以规范分析、实证分析和专业访谈为调研方法，深入建筑行业和司法一线，总结当下审判症结和行业困境。针对性地从表见代理的构成要件切入，深度结合实证案例进行分析，构建了一套能为法官实际操作的“审判新方法”，并为商事主体编织“风险防范网”。
民间借贷法律规制研究,法律,南京师范大学,本作品是针对民间借贷的法律规制进行研究的调研报告，作品采用实证的研究方法，基于对江苏省民间借贷现状以及江苏省民间借贷法律监管典型做法的剖析，总结经验，分析存在的问题，并站在法学的专业视角上给出针对性的对策建议，草拟相关建议稿，希望能为江苏省乃至全国经济社会的健康持续发展贡献绵薄之力。
民间金融创新监管视角下的P2P网贷平台法律规制研究,法律,中央民族大学,P2P网络借贷平台作为一个民间金融与现代网络技术结合的新事物，是民间金融的一大创新，但其在具有积极意义的同时也存在巨大潜在风险，需要重点研究其法律监管问题。本作品拟通过借鉴国外相关研究成果加以自己的思考和探索，以期能对P2P网络借贷平台的法律规制问题提供一些有益的参考。
莫让债权付东流,法律,中国人民大学, 司法拍卖乱象是司法执行难的主要原因之一。目前我国司法拍卖主要采取委托拍卖公司拍卖的办法。委托拍卖中的高额佣金和腐败现象严重危害了债权人的权利，使债权“付之东流”。2012年，随着民诉法“委托拍卖原则”的删除，浙江省高院联合淘宝在网上开设了司法拍卖平台。此举去除拍卖公司参与，完全消除了佣金产生的负担，显著提高了拍卖成交率、溢价率，有效维护了债权人利益，拥有广阔的发展空间。
南水北调中线工程水资源保护法律制度研究 ,法律,北京理工大学,南水北调中线工程作为缓解中国北方水资源严重短缺局面的重大战略性工程，对促进我国南北方经济、社会、环境的协调发展起到重要作用。团队成员对北京市、安康市等10个地区进行实地调研、座谈走访，对南水北调中线工程水资源保护中的具体制度、法律文件进行分析，结合我国生态建设、水资源保护的现状与问题，立足我国环境保护基本制度，借鉴国外跨流域调水的先进经验，提出针对南水北调工程等跨流域调水工程的单行法的立法建议。
山西省县级人民政府网络信息公开调研报告,法律,山西大学,本调研报告以山西省起草、论证《政府信息公开规定》和《山西省信息化条例》为契机，对山西省120个县级政府网站“政府信息公开栏”进行3个月的数据收集、分析，指出现有成效、存在的问题，并在此基础上就完善网络信息公开内容、提升信息透明度、规范信息公开方式等提出相关建议。为促进山西省政府关于信息公开的地方性立法提供重要的基础性数据，同时对我国“推进政务公开、确保公众知情权”具有重要意义。
社会转型时期替代性纠纷解决机制的创新尝试,法律,厦门大学, 在“半生不熟”的社会关系、“司法缺位”的救济现状及依法治国方略地位提升的背景下，厦门市率先开展了“无讼社区”的创建活动。课题组通过实地走访厦门市的三个“无讼社区”试点地，分析其实践模式之间的区别与特点，总结无讼社区运行模式的优势，并发现实施过程中的不足之处，提出完善对策。最后从厦门“无讼社区”构建出发，总结该制度对法治建设的意义。
提升民族地区普法工作实效的路径选择,法律,云南大学, 少数民族地区，由于长期受到民族习惯法调整，现代法治长期缺失这一特殊性的存在，使得用传统普法方法在当地推行国家制定法的效率较低。少数民族习惯法与具有普遍性的国家法律分享着一些共同的价值观，又有着其特殊性，其是各民族社会秩序的重要基础，因此对它不能进行破坏性的改造，而应该进行有针对性的调适。作品基于国家法与民族习惯法的互动性，探究提升民族地区普法工作实效的路径选择。
我国涉海司法实践新研究,法律,浙江工商大学,本文重点讲述了项目组在海洋经济崛起，涉海法律诉讼量迅增的背景下，深入开展社会调研活动和研读大量同行研究成果后，总结并剖析了目前海洋法律服务业存在的突出问题。为帮助解决这些问题，项目组自主设计了以海商法为主要内容的SROB法律逻辑框架，结合了CBR计算机技术，开拓性地研发了涉海专业性模拟审判系统——海洋之星模拟审判系统，推动了法律智能系统研究的发展。
刑事诉讼变更管辖问题研究,法律,中国政法大学,文章旨在通过实地走访调查，对三地的变更管辖制度进行详细解释。同时对刑事诉讼变更管辖制度进行科学的学理探讨，对现行制度进行反思和重构，以期促进变更管辖在我国不断走向深入，实现其立法价值。文章可以分为5个大的部分。一是前言，主要是提出问题。二是对实证调研的数据资料进行分析。三是对变更管辖的理论探讨，也即分析问题。四是对变更管辖制度的反思，也即解决问题。五是结论。
中美知识产权争端中的“恶名市场”问题调查报告及对策分析,法律,中南财经政法大学,“恶名市场”问题是中美知识产权争端中出现的新问题，自其产生以来就受到了国家的高度重视，但是国内外对此问题鲜有研究。本调查报告根据调查问卷、实地走访，访谈以及文献综述等多种调研方式所搜集的数据和文献资料，客观辩证地分析“恶名市场”问题。合理确定政府机关、司法机关、社会组织和社会公众在知识产权保护中的责任与义务，综合协调立法、执法、普法建设，推动知识产权保护合力的形成。
“45天速成”，并非危“鸡”四伏,管理,河南农业大学,2012年11月，被媒体曝光的“45天速成鸡事件”将肉鸡生产的安全问题推向了风口浪尖。由于消费者缺乏对“45天速成鸡”的科学认识，导致“速成鸡”销售量大大降低，对整个肉鸡养殖行业造成很大的冲击。本作品旨在通过调查，针对消费者最关注的问题，科学解读“45天速成鸡”，回答消费者最关心的问题，通过“45天速成鸡”现象引发了对食品安全等问题的思考。
“长株潭3+5城市群”废旧电池“协同创新”循环利用模式实践研究,管理,中南大学, 作品连续3年通过在“长株潭3+5城市群”开展实地调研、大型公益活动与科技帮扶工作，取得了一系列成果，产生了良好的社会影响。在中南大学和娄底市开展了废旧电池回收大型环保公益活动，直接促成了娄底全国首个“城市矿山”回收利用产业化基地的建成；开展了废旧电池回收利用现状的调查研究和实践分析，构建了系统的回收利用体系和“政产研学金”五位一体的协同创新合作机制，并逐步开始进行科技攻关。
促进发达县域地区新能源利用的有益探索,管理,南京航空航天大学, 随着我国经济社会的快速发展，能源和环境问题日益凸显，“十八大”中提出要推动能源生产和消费革命，支持节能低碳产业和新能源、可再生能源发展。本团队以昆山市作为发达县域的典型代表，通过调查表、访谈和实地数据收集等形式深入昆山市政府部门、46家企业和58个重点项目，了解其新能源开发基础及发展现状，通过挖掘存在问题，探究其在新能源利用方面的经验，在此研究基础上推广总结发达县域提升新能源利用的对策。
大城小梦,管理,同济大学, 在新型城镇化的背景下，“夹心层”的住房保障成为关系社会发展的重要问题。现行的公租房体系是解决此问题的良好途径；但受多因素影响，其运营出现种种问题。作品以上海为例，通过调研获取第一手数据，依托专业优势，从社会、经济、建筑的角度考量该问题。从公租房供应现状和使用需求出发，分析当下公租房供需关系中的五大矛盾，提出有针对性应对策略，并开发虚拟选配网络平台，阐述其对接目前供需诉求的运作模式。
高新区产业集群协同创新网络建设调研报告,管理,武汉科技大学,作品以湖北省为例，以协同创新网络建设为突破口对高新区产业集群进行调研。项目组成员采用实地调研和查阅统计数据相结合的方式，获取大量数据；在此基础上，从整体运行效率（DEA）、集群化发展水平、协同创新能力评价及其制约因素这4个维度定量分析；从而提炼了目前制约高新区创新网络建设的问题；进而从网络整合优化和战略构想两方面提出对策建议，对全国的高新区建设发展存在指导意义。
河北省中小企业就业人员社会保险现状调查研究,管理,河北大学,本次中小企业社会保险调查在唐山、保定、张家口三个不同发展水平的城市进行。通过发放问卷、走访记录和深度座谈相结合的调研方式，深入300余家中小企业，掌握大量一手资料和可靠数据。总结出河北省中小企业就业人员的社会保险现状和问题以及出现问题的原因，并相应地提出了诸多切实可行的解决方案。希望通过这些切实可行的解决方案，能够得到政府有关部门的重视及反响，进而改善中小企业就业人员的社会保险状况。
基于物联网技术的城市公共交通服务管理平台设计,管理,山东交通学院,“基于物联网技术的城市公共服务管理模式——智慧公交”项目，是建立一个基于物联网技术的智慧公交服务平台，通过车联网、视联网、物联网三个层面组成智慧公交管理模式，通过ITS、RFID等技术，提升人、车、站综合协调能力，实现乘客智慧出行、线路智能优化、车辆智慧运行。该模式希望通过公共交通的智慧化管理，达到公共交通“出行更便捷、乘坐更舒适、换乘更方便、运营更安全”的目标。
南方特色水果供应链的品质安全风险评价与管理,管理,广州大学,食品问题频发对食品安全风险评价工作提出了更高要求。本论文以南方特色水果龙眼为研究对象，研究龙眼供应链的生产、供应、物流、零售、消费环节，结合大量的实地调研和模拟实验，探讨龙眼供应链过程存在的风险现状。通过调研，运用层次分析法等建立安全风险评价指标体系。通过实验，运用专家评分法等建立品质安全指标体系，提出防范措施，为其他南方水果提供研究思路，降低食品安全问题的发生几率，提高其经济效益。
农村宅基地置换：如何成为一项好政策？,管理,浙江大学,农村宅基地置换是推进我国城镇化战略的重要抓手。先行者J市提出的“两分两换”宅基地置换政策在全国范围内引起了广泛的讨论与关注。作品重点关注J市三个试点镇宅基地置换的始末，采取多案例分析方法，梳理出农村宅基地置换工作中存在的三大困境，并从公共政策过程视角总结J市置换工作中的已有经验，提出破解困境的建议，最终使农村宅基地置换成为“农民满意、政府愿意、发展受益”的好政策，推动我国城镇化战略的实施。
如何让“菜园子”直通“菜篮子”? ,管理,河南工业大学,农民卖菜难，市民买菜贵是社会各界所共同关注的民生问题，如何使“菜篮子”直通“菜园子”是解决这个问题的一个很有效的手段。以“农超对接”模式为新方法的农产品物流体系的构建在一定程度上能够解决这个问题。郑州作为全国“农超对接”工作的试点城市，在这个方面的发展具有借鉴意义。因此我们对郑州市“农超对接”的发展现状，存在的问题进行了调查、分析并提供有效的建议和对策。
陕南大移民后期扶持政策效果的调查,管理,东北石油大学,2011年5月6日陕南移民搬迁工程的启动，引起了全社会的广泛关注。陕西省政府出台了一系列后期扶持政策。为了解其具体效果，我们深入移民安置点进行了实地调查。通过问卷调查，个案访谈等方式获取了相关的数据与资料，经过SPSS软件分析后，发现扶持政策积极效果明显，但政策本身以及政策推行过程中存在一些不足。针对发现的这些问题，我们依据“推-拉理论”并结合“IRR模型”，为政府完善政策提供可行性建议。
水泥企业工作水平评估体系的构建,管理,洛阳理工学院,"基于水泥行业产能过剩的背景,以河南省全部51家水泥企业的工作水平为研究对象，以交叉学科理论为基础，构建了普通水泥企业多层评估指标和基本要求的评估体系。运用TOPSIS和模糊综合评判等模型对企业进行横向排序和单一企业纵向比较的实例研究，通过评估找出了阈值。拟定《河南省绿色水泥企业技术要求（草稿）》地方标准。为水泥行业及政府决策提出参考建议。课题受到河南省建材工业协会的好评；课题组已发表论文8篇。"
西部无电区太阳能应用管理模式创新,管理,华北电力大学(保定),十八大报告提出，坚持节约资源和保护环境的基本国策。实地调研发现，部分无电地区存在太阳能发电设备（户用设备、离网电站）因缺少维护维修而损坏废弃，影响当地居民长期持续用电，导致公共财政资金重复投入。作品基于“改善民生，促进地区平衡发展；政府主导与监管，保证长期用电；五方协调联动，提高投资效益；发展绿色电力，坚持节能环保”四项原则，提出政府、国家电网、企业、高校及农牧民五方协调联动的新型管理模式。
心理契约对规范型营销渠道治理方式影响,管理,中国人民大学, 本文将心理契约引入规范型渠道治理进行研究，提出6个假设，通过对江西省农业龙头企业的调查，采用多元层次回归方法对数据分析，探讨心理契约对规范性渠道治理方式的影响，结果显示：交易型心理契约纬度对规范性渠道治理方式有负向显著影响，关系型心理契约纬度对规范性渠道治理方式有正向显著影响，规范性渠道治理方式对渠道投机行为有负向显著影响。论文强调心理契约对规范性渠道治理的重要性和必要性。
新型农村社会养老保险基金收支平衡研究,管理,中南民族大学,本研究通过对湖南省通道侗族自治县的调查，运用保险精算技术，构建新型农村社会养老保险基金收支预测模型，测算该县在目标区间养老保险基金收支变化趋势，结果发现：2017年开始出现缺口，2055年缺口达到最大值，随后会逐渐降低。因此，为了实现新农保基金收支长期平衡发展，政府应进一步完善新农保制度设计，加强保险基金监管力度，创新新农保基金投资机制，加快新农保相关法律建设，加大对贫困地区的财政支持力度。
异地老人医疗报销障碍、损失评估及改进方案,管理,华北电力大学(保定),医疗保险报销问题是异地养老老人面临的最大障碍。基于京津冀调查发现，异地老人医疗报销满意度低；异地医疗存在报销手续繁琐、损失大、抑制就医需求等问题；结合宏观政策比较分析发现，医疗保险地域分割、人群分割是主要成因。利用人口和医疗数据，评估异地老人医疗报销的损失规模和变动趋势。最后，针对异地就医问题，系统提出基于现有制度的两地报销互认、允许老人异地缴费参保、统一的国民医疗保险三种改革方案及配套措施。
整车物流资源计划编制,管理,昆明理工大学,本研究以安吉物流公司为切入点，设计、编制一套整车资源计划系统，以解决目前整车物流行业在资源计划编制环节存在的问题，为接下来的调度环节做准备。
中国非正规小微企业生存性与合法性研究,管理,中山大学,有着非正规特性的小微企业为我国在世界就业战争中规模性地提供了劳动力主力军，同时也是“中国制造”的重要生产要素基础。本项研究工作对全国450家小微企业和广东省8个集群内790家小微企业进行大样本深入调研和实地访谈，基于社会网络理论与制度理论的视角，对不同集群内小微企业的生存状态进行对比分析研究，并探索了利用社会网络提升非正规小微企业生存性与合法性的途径。提出要强化“中国集群制造”的文化宣传等建议。
中国慢性病防治“四位一体”管理模式的探索,管理,东南大学,本项目在全面分析国内外慢性病管理模式基础上，针对国内模式不足，借鉴同伴支持理念和志愿服务，提出构建“医院-社区-患者-志愿者”四位一体慢性病防治管理新模式。并以南京九社区的糖尿病患者为例试点运行，通过定量分析（生理、心理、社会、经济等指标）和定性访谈（专家、患者、社区人员、志愿者、管理人员等），评估该模式实施的可行性、有效性、经济性，针对遇到的困难提出解决策略，同时就模式进一步推广提出政策建议。
中小企业高端化开放式创新模式推广的探索,管理,江苏大学,苏州中小企业创新实绩打破学术界对中小企业的认知。为总结推广苏州中小企业技术创新成功经验，作品进行多阶段、递归式调查：5家典型企业调查表明高端化开放式创新模式是中小企业高效创新的驱动力；360份样本调查表明苏州中小企业正处迈向高端化开放式创新的蓄势积累阶段；550份样本调查和比较研究揭示迈向高端化开放式创新的瓶颈因素。基于国内外比较研究从企业和政府角度设计中小企业高端化开放式创新模式全面推广的对策。
PM2.5公众认知及其对政府政策制定的价值研究 ,管理,南京信息工程大学,生态文明建设是十八大中提出的一项重要精神，在我国PM2.5问题日益严峻的今天，对其进行监测与防控极具意义。本项目组结合调查问卷与多方访谈，运用规范的分析方法对我国PM2.5公众认知情况进行了深入研究，并就其对政府政策制定的价值作出探讨，同时结合协商民主理论，探索出公众参与PM2.5政策制定的四级阶梯模型，为政府部门制定治理PM2.5的政策提供参考。
城市社区综合体制改革的模式创新,管理,安徽大学, 本作品基于安徽省铜陵市率先开创的区直管社区综合体制的“铜陵模式”，通过多学科视角尝试探索城市社区综合体制的模式创新，以期解决中国向来以政府主导型为主体的城市社区综合体制中的问题，促进社区建设和城市化进程。
构建平安社区，“非典”十年新启示,管理,暨南大学, 本文从系统动力学理论一个崭新的视角对社区应急管理进行系统分析和系统模型构建，项目合理地运用多种数理方法进行研究，设计了一套有效评估社区综合应急能力指标体系和评价方法。同时采取多种方式对广东省部分社区应急能力发展现状进行了深入地调查研究，梳理了社区应急管理发展概况、特点以及问题，最后就加强社区应急能力进行了政策性的探讨和思考。
基于新浪微博平台的政务微博运营问题调查报告,管理,西安邮电大学,作品以新浪微博为研究平台，以运营规范化为目的，以当前中国国情为背景，结合相关文献，通过问卷调查了解民众态度和参与情况，并访问了多家陕西省相关政府单位，得出了新浪政务微博现存的八大主要问题。通过借鉴国内外政务微博运营的先进经验，结合国内实况，最终从重视政务微博、政务微博规范化、完善的推广和发展措施、建立绩效考评和奖惩制度四个方面整理得出一套完善系统的解决方案。作品顺应时代，挑战社会新问题，专注实践。
